{
  "schema_version": 1,
  "run_id": "20260901-000000-fixture-brand-ab12cd",
  "brand_id": "fixture-brand",
  "created_at": "2026-09-01T00:00:00Z",
  "updated_at": "2026-09-01T00:05:00Z",
  "state": "IMAGE_APPROVED",
  "credits": {
    "starting_balance": 500,
    "estimate": 12,
    "max_credits": 20,
    "observed_delta_total": 11,
    "concurrent_spend_suspected": false
  },
  "source_asset": {
    "asset_id": "product-jar-front",
    "checksum_sha256": "aaaaaaaaaaaaaaaaaaaaaaaaaaaaaaaaaaaaaaaaaaaaaaaaaaaaaaaaaaaaaaaa"
  },
  "plan": {
    "approval_digest": "sha256:deadbeef",
    "render_strategy": "exact-asset",
    "template_id": "tmpl-image-edit-001",
    "template_snapshot_at": "2026-09-01T00:01:00Z",
    "operation": "image-edit",
    "model": "nano-banana-2/edit",
    "prompt": "Place the untouched product jar on a rustic wooden shelf with warm morning light.",
    "max_credits": 20,
    "cost_estimate": 12,
    "fallbacks": []
  },
  "image": {
    "request_id": "req-image-001",
    "status": "succeeded",
    "submitted_at": "2026-09-01T00:02:00Z",
    "completed_at": "2026-09-01T00:03:00Z",
    "output_path": "media/generated-image.jpg",
    "checksum_sha256": "bbbbbbbbbbbbbbbbbbbbbbbbbbbbbbbbbbbbbbbbbbbbbbbbbbbbbbbbbbbbbbbb",
    "credits_observed_delta": 11
  },
  "image_approval": {
    "decision": "approved",
    "bound_checksum_sha256": "bbbbbbbbbbbbbbbbbbbbbbbbbbbbbbbbbbbbbbbbbbbbbbbbbbbbbbbbbbbbbbbb",
    "decided_at": "2026-09-01T00:04:00Z",
    "decision_reference": "discord-thread-1546735219921522818#msg-42"
  }
}
